<?xml version="1.0" encoding="UTF-8"?>
<world xmlns:xsi="http://www.w3.org/2001/XMLSchema-instance"
       xsi:noNamespaceSchemaLocation="world.xsd">
  <n>500</n>
  <choice>
    <record>
      <n>1</n>
      <country>Netherlands</country>
      <region>North Holland</region>
      <city>Amsterdam</city>
    </record>
    <record>
      <n>2</n>
      <country>Netherlands</country>
      <region>South Holland</region>
      <city>Rotterdam</city>
    </record>
    <record>
      <n>3</n>
      <country>Netherlands</country>
      <region>Utrecht</region>
      <city>Utrecht</city>
    </record>
    <record>
      <n>4</n>
      <country>Netherlands</country>
      <region>Gelderland</region>
      <city>Arnhem</city>
    </record>
    <record>
      <n>5</n>
      <country>Netherlands</country>
      <region>Limburg</region>
      <city>Maastricht</city>
    </record>
    <record>
      <n>6</n>
      <country>Germany</country>
      <region>Bavaria</region>
      <city>Munich</city>
    </record>
    <record>
      <n>7</n>
      <country>Germany</country>
      <region>North Rhine-Westphalia</region>
      <city>Cologne</city>
    </record>
    <record>
      <n>8</n>
      <country>Germany</country>
      <region>Hesse</region>
      <city>Frankfurt</city>
    </record>
    <record>
      <n>9</n>
      <country>Germany</country>
      <region>Berlin</region>
      <city>Berlin</city>
    </record>
    <record>
      <n>10</n>
      <country>Germany</country>
      <region>Saxony</region>
      <city>Dresden</city>
    </record>
    <record>
      <n>11</n>
      <country>France</country>
      <region>Île-de-France</region>
      <city>Paris</city>
    </record>
    <record>
      <n>12</n>
      <country>France</country>
      <region>Provence-Alpes-Côte d'Azur</region>
      <city>Marseille</city>
    </record>
    <record>
      <n>13</n>
      <country>France</country>
      <region>Auvergne-Rhône-Alpes</region>
      <city>Lyon</city>
    </record>
    <record>
      <n>14</n>
      <country>France</country>
      <region>Hauts-de-France</region>
      <city>Lille</city>
    </record>
    <record>
      <n>15</n>
      <country>France</country>
      <region>Nouvelle-Aquitaine</region>
      <city>Bordeaux</city>
    </record>
    <record>
      <n>16</n>
      <country>United States</country>
      <region>California</region>
      <city>Los Angeles</city>
    </record>
    <record>
      <n>17</n>
      <country>United States</country>
      <region>New York</region>
      <city>New York City</city>
    </record>
    <record>
      <n>18</n>
      <country>United States</country>
      <region>Illinois</region>
      <city>Chicago</city>
    </record>
    <record>
      <n>19</n>
      <country>United States</country>
      <region>Texas</region>
      <city>Houston</city>
    </record>
    <record>
      <n>20</n>
      <country>United States</country>
      <region>Arizona</region>
      <city>Phoenix</city>
    </record>
    <record>
      <n>21</n>
      <country>Japan</country>
      <region>Tokyo Prefecture</region>
      <city>Tokyo</city>
    </record>
    <record>
      <n>22</n>
      <country>Japan</country>
      <region>Osaka Prefecture</region>
      <city>Osaka</city>
    </record>
    <record>
      <n>23</n>
      <country>Japan</country>
      <region>Aichi Prefecture</region>
      <city>Nagoya</city>
    </record>
    <record>
      <n>24</n>
      <country>Japan</country>
      <region>Hokkaido</region>
      <city>Sapporo</city>
    </record>
    <record>
      <n>25</n>
      <country>Japan</country>
      <region>Fukuoka Prefecture</region>
      <city>Fukuoka</city>
    </record>
    <record>
      <n>26</n>
      <country>United Kingdom</country>
      <region>England</region>
      <city>London</city>
    </record>
    <record>
      <n>27</n>
      <country>United Kingdom</country>
      <region>Scotland</region>
      <city>Edinburgh</city>
    </record>
    <record>
      <n>28</n>
      <country>United Kingdom</country>
      <region>Wales</region>
      <city>Cardiff</city>
    </record>
    <record>
      <n>29</n>
      <country>United Kingdom</country>
      <region>Northern Ireland</region>
      <city>Belfast</city>
    </record>
    <record>
      <n>30</n>
      <country>United Kingdom</country>
      <region>Yorkshire</region>
      <city>Leeds</city>
    </record>
    <record>
      <n>31</n>
      <country>Canada</country>
      <region>Ontario</region>
      <city>Toronto</city>
    </record>
    <record>
      <n>32</n>
      <country>Canada</country>
      <region>Quebec</region>
      <city>Montreal</city>
    </record>
    <record>
      <n>33</n>
      <country>Canada</country>
      <region>British Columbia</region>
      <city>Vancouver</city>
    </record>
    <record>
      <n>34</n>
      <country>Canada</country>
      <region>Alberta</region>
      <city>Calgary</city>
    </record>
    <record>
      <n>35</n>
      <country>Canada</country>
      <region>Manitoba</region>
      <city>Winnipeg</city>
    </record>
    <record>
      <n>36</n>
      <country>Australia</country>
      <region>New South Wales</region>
      <city>Sydney</city>
    </record>
    <record>
      <n>37</n>
      <country>Australia</country>
      <region>Victoria</region>
      <city>Melbourne</city>
    </record>
    <record>
      <n>38</n>
      <country>Australia</country>
      <region>Queensland</region>
      <city>Brisbane</city>
    </record>
    <record>
      <n>39</n>
      <country>Australia</country>
      <region>Western Australia</region>
      <city>Perth</city>
    </record>
    <record>
      <n>40</n>
      <country>Australia</country>
      <region>South Australia</region>
      <city>Adelaide</city>
    </record>
    <record>
      <n>41</n>
      <country>Brazil</country>
      <region>São Paulo</region>
      <city>São Paulo</city>
    </record>
    <record>
      <n>42</n>
      <country>Brazil</country>
      <region>Rio de Janeiro</region>
      <city>Rio de Janeiro</city>
    </record>
    <record>
      <n>43</n>
      <country>Brazil</country>
      <region>Bahia</region>
      <city>Salvador</city>
    </record>
    <record>
      <n>44</n>
      <country>Brazil</country>
      <region>Paraná</region>
      <city>Curitiba</city>
    </record>
    <record>
      <n>45</n>
      <country>Brazil</country>
      <region>Minas Gerais</region>
      <city>Belo Horizonte</city>
    </record>
    <record>
      <n>46</n>
      <country>India</country>
      <region>Maharashtra</region>
      <city>Mumbai</city>
    </record>
    <record>
      <n>47</n>
      <country>India</country>
      <region>Delhi</region>
      <city>New Delhi</city>
    </record>
    <record>
      <n>48</n>
      <country>India</country>
      <region>Karnataka</region>
      <city>Bengaluru</city>
    </record>
    <record>
      <n>49</n>
      <country>India</country>
      <region>Tamil Nadu</region>
      <city>Chennai</city>
    </record>
    <record>
      <n>50</n>
      <country>India</country>
      <region>West Bengal</region>
      <city>Kolkata</city>
    </record>
    <record>
      <n>51</n>
      <country>Netherlands</country>
      <region>North Holland</region>
      <city>Amsterdam</city>
    </record>
    <record>
      <n>52</n>
      <country>Netherlands</country>
      <region>South Holland</region>
      <city>Rotterdam</city>
    </record>
    <record>
      <n>53</n>
      <country>Netherlands</country>
      <region>Utrecht</region>
      <city>Utrecht</city>
    </record>
    <record>
      <n>54</n>
      <country>Netherlands</country>
      <region>Gelderland</region>
      <city>Arnhem</city>
    </record>
    <record>
      <n>55</n>
      <country>Netherlands</country>
      <region>Limburg</region>
      <city>Maastricht</city>
    </record>
    <record>
      <n>56</n>
      <country>Germany</country>
      <region>Bavaria</region>
      <city>Munich</city>
    </record>
    <record>
      <n>57</n>
      <country>Germany</country>
      <region>North Rhine-Westphalia</region>
      <city>Cologne</city>
    </record>
    <record>
      <n>58</n>
      <country>Germany</country>
      <region>Hesse</region>
      <city>Frankfurt</city>
    </record>
    <record>
      <n>59</n>
      <country>Germany</country>
      <region>Berlin</region>
      <city>Berlin</city>
    </record>
    <record>
      <n>60</n>
      <country>Germany</country>
      <region>Saxony</region>
      <city>Dresden</city>
    </record>
    <record>
      <n>61</n>
      <country>France</country>
      <region>Île-de-France</region>
      <city>Paris</city>
    </record>
    <record>
      <n>62</n>
      <country>France</country>
      <region>Provence-Alpes-Côte d'Azur</region>
      <city>Marseille</city>
    </record>
    <record>
      <n>63</n>
      <country>France</country>
      <region>Auvergne-Rhône-Alpes</region>
      <city>Lyon</city>
    </record>
    <record>
      <n>64</n>
      <country>France</country>
      <region>Hauts-de-France</region>
      <city>Lille</city>
    </record>
    <record>
      <n>65</n>
      <country>France</country>
      <region>Nouvelle-Aquitaine</region>
      <city>Bordeaux</city>
    </record>
    <record>
      <n>66</n>
      <country>United States</country>
      <region>California</region>
      <city>Los Angeles</city>
    </record>
    <record>
      <n>67</n>
      <country>United States</country>
      <region>New York</region>
      <city>New York City</city>
    </record>
    <record>
      <n>68</n>
      <country>United States</country>
      <region>Illinois</region>
      <city>Chicago</city>
    </record>
    <record>
      <n>69</n>
      <country>United States</country>
      <region>Texas</region>
      <city>Houston</city>
    </record>
    <record>
      <n>70</n>
      <country>United States</country>
      <region>Arizona</region>
      <city>Phoenix</city>
    </record>
    <record>